{
  "schemaVersion": "1.0",
  "evidenceRecordId": "evidence-febe039f9cda91c2",
  "candidateId": "candidate-17878d4c5d338b8b",
  "reviewId": "review-c40a78f1d963d84e",
  "supplierAssessmentId": "synthetic-managed-ai-service",
  "evidenceFamily": "security-privacy",
  "sourceReference": "https://example.com/supplier-evidence/security-privacy-v1",
  "sourceVersion": "v1",
  "contentDigest": "sha256:aaaaaaaaaaaaaaaaaaaaaaaaaaaaaaaaaaaaaaaaaaaaaaaaaaaaaaaaaaaaaaaa",
  "observedAt": "2026-09-01T00:00:00.000Z",
  "validUntil": "2026-12-01T00:00:00.000Z",
  "recordState": "current",
  "approvedByRole": "evidence-approver",
  "approvedAt": "2026-09-05T00:20:00.000Z",
  "retentionClass": "synthetic-90-day",
  "policyRef": "https://example.com/policies/synthetic-evidence-retention-v1",
  "legalHoldState": "not-held",
  "deletionState": "retained",
  "auditEventIds": ["audit-df28f34cc3771575"]
}
